{
  "kind": "tyre",
  "schema_version": 1,
  "id": "core.tyre.hard",
  "name": "Hard",
  "description": "Reference fictional compound; wear in percentage points per reference lap.",
  "short": "H",
  "color": "d5d6c8",
  "family": "slick",
  "grip": 0.98,
  "wear": 2.4,
  "optimum_c": 94.0,
  "thermal_profile_id": "core.tyre_thermal.four_wheel",
  "surface_response": {
    "dry_floor": 0.4,
    "dry_onset": 0.07,
    "dry_loss": 0.85,
    "inter_base": 0.88,
    "inter_gain": 0.2,
    "inter_peak": 0.72,
    "inter_loss": 0.7,
    "wet_base": 0.77,
    "wet_gain": 0.33
  }
}
